{
  "schema_version": 1,
  "profile_version": "0.1.0",
  "spec_version": "0.1.0",
  "profiles": [
    {
      "id": "minimal",
      "level": 1,
      "summary": "Lifecycle-safe output adapter for non-interactive or externally driven doors.",
      "required_operations": [
        "terminal.write",
        "session.connection_state",
        "lifecycle.exit",
        "lifecycle.disconnect"
      ]
    },
    {
      "id": "interactive",
      "level": 2,
      "summary": "Interactive door adapter with terminal input and basic caller context.",
      "required_operations": [
        "terminal.write",
        "terminal.read_key",
        "session.identity",
        "session.node",
        "session.connection_state",
        "lifecycle.exit",
        "lifecycle.disconnect"
      ]
    },
    {
      "id": "complete",
      "level": 3,
      "summary": "Complete ODS Core adapter implementing every current core and optional operation.",
      "required_operations": [
        "terminal.write",
        "terminal.read_key",
        "terminal.read_line",
        "session.identity",
        "session.node",
        "session.time_left",
        "session.connection_state",
        "status.set",
        "bbs.command",
        "lifecycle.exit",
        "lifecycle.disconnect"
      ]
    }
  ]
}
